{
  "$schema": "https://json-schema.org/draft/2020-12/schema",
  "$id": "mdoc-credentials-v1.schema.json",
  "title": "longfellow-vectors mdoc credential vector, v1",
  "description": "Sidecar for a CBOR credential under vectors/mdoc/credentials/.",
  "type": "object",
  "properties": {
    "schema": { "const": "mdoc-credentials-v1.schema.json" },
    "doctype": {
      "type": "string",
      "minLength": 1,
      "description": "DocType read from the credential. Present only when the CBOR parsed as a DeviceResponse at write time."
    },
    "device_key": {
      "type": "string",
      "minLength": 1,
      "description": "Vector name of the credential's device key. Present only when the key vector's public half matched the credential's deviceKeyInfo at write time."
    },
    "ds_certificate": {
      "type": "string",
      "minLength": 1,
      "description": "Vector name of the credential's document-signer certificate. Present only when the certificate's bytes matched the credential's x5chain leaf at write time."
    },
    "sha256": {
      "$ref": "common-v1.schema.json#/$defs/sha256hex",
      "description": "SHA-256 of the sibling .cbor file's bytes."
    },
    "provenance": { "$ref": "common-v1.schema.json#/$defs/provenance" },
    "comment": {
      "type": "string",
      "minLength": 1,
      "description": "Construction facts about the vector."
    }
  },
  "required": ["schema", "sha256", "provenance"],
  "additionalProperties": false
}
