{
  "schema": "mdoc-credentials-v1.schema.json",
  "device_key": "misplaced-schema",
  "sha256": "e3b0c44298fc1c149afbf4c8996fb92427ae41e4649b934ca495991b7852b855",
  "provenance": {
    "type": "constructed",
    "generator": "fixture",
    "created": "2026-08-25"
  },
  "comment": "Credential vector whose device_key names misplaced-schema. The name resolves against keys/, which declares it, even though that sidecar's schema does not belong there."
}
