{
  "schema": "mdoc-credentials-v1.schema.json",
  "sha256": "2c09266b392ffd5338606549fd3aee3458fc50009719d474ea648bc16db9857b",
  "doctype": "eu.europa.ec.av.1",
  "device_key": "device-longfellow-vectors-01",
  "ds_certificate": "ds-longfellow-vectors-2026-2036",
  "provenance": {
    "type": "constructed",
    "generator": "generate.py credential --name av-over-18 --ds-certificate ds-longfellow-vectors-2026-2036 --device-key device-longfellow-vectors-01 --doctype eu.europa.ec.av.1 --claim eu.europa.ec.av.1 age_over_18 true --valid-from 2026-01-01T00:00:00Z --valid-until 2028-01-01T00:00:00Z --seed 04"
  }
}
