{
  "schema": "mdoc-credentials-v1.schema.json",
  "ds_certificate": "no-such-certificate",
  "sha256": "e3b0c44298fc1c149afbf4c8996fb92427ae41e4649b934ca495991b7852b855",
  "provenance": {
    "type": "constructed",
    "generator": "fixture",
    "created": "2026-08-24"
  },
  "comment": "Credential vector whose ds_certificate names no certificate vector."
}
