{
  "schema": "mdoc-credentials-v1.schema.json",
  "sha256": "e3b0c44298fc1c149afbf4c8996fb92427ae41e4649b934ca495991b7852b855",
  "ds_certificate": "signer",
  "provenance": {
    "type": "constructed",
    "generator": "fixture",
    "created": "2026-08-24"
  },
  "comment": "Credential vector for the loader tests, carrying ds_certificate. Its blob is empty and device_key is absent."
}
