{
  "schema": "mdoc-credentials-v1.schema.json",
  "sha256": "e3b0c44298fc1c149afbf4c8996fb92427ae41e4649b934ca495991b7852b855",
  "provenance": {
    "type": "repository",
    "repo": "github.com/example/fixtures",
    "ref": "abababababababababababababababababababab",
    "path": "credentials/bare-cred.cbor"
  },
  "comment": "Credential vector for the loader tests with doctype, device_key, and ds_certificate absent. Its blob is empty, so claims() raises."
}
