{
  "schema": "mdoc-credentials-v1.schema.json",
  "device_key": "no-such-key",
  "sha256": "d4b0c0a4a8cc6c257aed34d16d39dd3c2d3539ed67fd4badd40aef16c1591715",
  "provenance": {
    "type": "constructed",
    "generator": "fixture"
  },
  "comment": "Credential vector whose device_key names no key vector."
}
