{
  "schema": "mdoc-credentials-v1.schema.json",
  "doctype": "org.iso.18013.5.1.mDL",
  "device_key": "full-key",
  "sha256": "0a43b22d89fa2499be5c7704c9bf273260b0ca9588e4cd1897cd80f9c96cd97a",
  "provenance": {
    "type": "constructed",
    "generator": "fixture"
  },
  "comment": "Credential vector for the loader tests, carrying doctype and device_key. ds_certificate is absent."
}
