{
  "schema": "mdoc-credentials-v1.schema.json",
  "sha256": "af3b1d93d9ba1f1585d1c92e5a7dc240eaf223ff63982fc287f01e7b2ecabaa1",
  "doctype": "org.iso.18013.5.1.mDL",
  "provenance": {
    "type": "constructed",
    "generator": "fixture",
    "created": "2026-08-24"
  },
  "comment": "Credential vector whose blob is a synthetic DeviceResponse holding age_over_18 and issue_date, for the claims() tests."
}
